{
  "schema_version": "1.0",
  "episode_id": "E007",
  "episode_plan_git_blob_sha": "6a5646f3a397e09fa6859a15de888f65019f9482",
  "canvas": {
    "width": 1080,
    "height": 1350
  },
  "slides": [
    {
      "index": 1,
      "slide_id": "E007_S01",
      "items": [
        {
          "text_id": "E007_S01_CAPTION_01",
          "kind": "caption",
          "text": "회사에선 나름 멀쩡한 척함.",
          "box": [
            0.08,
            0.06,
            0.84,
            0.13
          ],
          "align": "center",
          "font_size": 58,
          "min_font_size": 44,
          "padding": 20,
          "line_spacing": 8,
          "radius": 24
        }
      ]
    },
    {
      "index": 2,
      "slide_id": "E007_S02",
      "items": []
    },
    {
      "index": 3,
      "slide_id": "E007_S03",
      "items": [
        {
          "text_id": "E007_S03_HARIN_01",
          "kind": "speech",
          "speaker": "Harin",
          "text": "오~\n오늘 좀 나오는데?",
          "box": [
            0.5,
            0.06,
            0.42,
            0.22
          ],
          "tail_to": [
            0.62,
            0.34
          ],
          "align": "center",
          "font_size": 52,
          "min_font_size": 40,
          "padding": 22,
          "line_spacing": 8,
          "radius": 36
        }
      ]
    },
    {
      "index": 4,
      "slide_id": "E007_S04",
      "items": []
    },
    {
      "index": 5,
      "slide_id": "E007_S05",
      "items": [
        {
          "text_id": "E007_S05_SECURITY_01",
          "kind": "speech",
          "speaker": "security_01",
          "text": "오~ 오늘 좀 나오는데~",
          "box": [
            0.46,
            0.07,
            0.46,
            0.17
          ],
          "tail_to": [
            0.69,
            0.34
          ],
          "align": "center",
          "font_size": 50,
          "min_font_size": 38,
          "padding": 20,
          "line_spacing": 8,
          "radius": 34
        }
      ]
    },
    {
      "index": 6,
      "slide_id": "E007_S06",
      "items": [
        {
          "text_id": "E007_S06_HARIN_01",
          "kind": "speech",
          "speaker": "Harin",
          "text": "…네?",
          "box": [
            0.08,
            0.1,
            0.28,
            0.14
          ],
          "tail_to": [
            0.33,
            0.4
          ],
          "align": "center",
          "font_size": 56,
          "min_font_size": 44,
          "padding": 18,
          "line_spacing": 8,
          "radius": 32
        }
      ]
    },
    {
      "index": 7,
      "slide_id": "E007_S07",
      "items": [
        {
          "text_id": "E007_S07_REACTION_01",
          "kind": "sfx",
          "text": "!?",
          "box": [
            0.12,
            0.16,
            0.22,
            0.14
          ],
          "align": "center",
          "font_size": 72,
          "min_font_size": 56,
          "padding": 8,
          "line_spacing": 4,
          "radius": 0
        }
      ]
    }
  ]
}
